{
  "schemaVersion": 1,
  "taskId": "CANARY-OFFICE-ENCRYPTION-CHARACTERIZATION-R01",
  "taskSpecVersion": 1,
  "profile": "BOUNDED_CODE_TASK",
  "declaredIntent": "Mevcut office-credential-encryption.util davranisini, yeni production semantigi uretmeden, characterization testiyle sabitle. Yalniz test dosyasi eklenir; util dosyasina dokunulmaz. Bu bir OPERATIONAL CANARY gorevidir: amaci orkestrasyon zincirinin ucdan uca calistigini kanitlamaktir.",
  "declaredIntentSha256": "fa648c98ff9d0d538a8a8d12dffa040fb03bb150ac6b086277594c36d03340b1",
  "boundaryPolicy": {
    "allowedRoots": [
      "project/apps/api/src/modules/office/__tests__/office-credential-encryption.characterization.spec.ts/"
    ],
    "maxChangedFiles": 1
  },
  "boundaryPolicySha256": "c9ac5282b1051c18de48b9d43c72c0ce957447fc8652257c1e6abb1738d75b02",
  "requiredTests": [
    {
      "argv": [
        "pnpm",
        "install",
        "--frozen-lockfile"
      ],
      "cwd": "project",
      "timeoutMs": 1800000
    },
    {
      "argv": [
        "pnpm",
        "--filter",
        "@hukuk/api",
        "exec",
        "prisma",
        "generate"
      ],
      "cwd": "project",
      "timeoutMs": 1800000
    },
    {
      "argv": [
        "pnpm",
        "exec",
        "jest",
        "--ci",
        "--forceExit",
        "--runInBand",
        "--runTestsByPath",
        "src/modules/office/__tests__/office-credential-encryption.characterization.spec.ts"
      ],
      "cwd": "project/apps/api",
      "timeoutMs": 1800000
    }
  ],
  "requiredTestsSha256": "d7f6c55b8753b47e6b82c0b8fc7ee33ba9b4d96058915de3501153fe56b8530e",
  "predecessorTaskIds": [],
  "baseDriftPolicy": "REFRESH_BEFORE_EXECUTION",
  "baseSha": "8d4bc9dea45da7a88b1b4fae5f9f30ad7761c0f6",
  "successorDisposition": "OWNER_AUTHORIZATION_REQUIRED"
}
