{
  "schemaVersion": 1,
  "taskId": "OFFICE-CAP-02-REPORTINGLINE-READ-CHARACTERIZATION-R01",
  "taskSpecVersion": 1,
  "profile": "BOUNDED_CODE_TASK",
  "declaredIntent": "ReportingLineService.listActive ve listEligible okuma yuzeylerinin bugunku tenant-scope, aktiflik ve profil filtrelerini, hicbir production davranisi degistirmeden test-only karakterize etmek.",
  "boundaryPolicy": {
    "allowedRoots": [
      "project/apps/api/src/modules/reporting-line/__tests__/reporting-line.service.spec.ts/"
    ],
    "maxChangedFiles": 1
  },
  "requiredTests": [
    {
      "argv": [
        "pnpm",
        "install",
        "--frozen-lockfile"
      ],
      "cwd": "project",
      "timeoutMs": 1800000
    },
    {
      "argv": [
        "pnpm",
        "--filter",
        "@hukuk/api",
        "exec",
        "prisma",
        "generate"
      ],
      "cwd": "project",
      "timeoutMs": 600000
    },
    {
      "argv": [
        "pnpm",
        "exec",
        "jest",
        "--ci",
        "--forceExit",
        "--runInBand",
        "--runTestsByPath",
        "src/modules/reporting-line/__tests__/reporting-line.service.spec.ts"
      ],
      "cwd": "project/apps/api",
      "timeoutMs": 900000
    },
    {
      "argv": [
        "pnpm",
        "exec",
        "jest",
        "--ci",
        "--forceExit",
        "--runInBand",
        "--runTestsByPath",
        "src/config/uyap-interest-crosswalk.spec.ts",
        "src/modules/address-discovery/confidence-score.tenant-boundary.spec.ts",
        "src/modules/address-discovery/uyap-query.service.spec.ts",
        "src/modules/address-task/address-task.controller.spec.ts",
        "src/modules/address-task/address-task.service.spec.ts",
        "src/modules/ai/ai.service.tenant-boundary.spec.ts",
        "src/modules/audit/__tests__/audit-metadata-builder.spec.ts",
        "src/modules/audit/__tests__/audit.service.attribution.spec.ts",
        "src/modules/automation/__tests__/all-passive-case-automation-stop.spec.ts",
        "src/modules/automation/__tests__/automation-tenant-guard-propagation.spec.ts",
        "src/modules/automation/__tests__/enforcement-action-guarded-write-path.spec.ts",
        "src/modules/automation/__tests__/enforcement-action-guarded-write-path.static-guard.spec.ts",
        "src/modules/automation/__tests__/enforcement-action-passivation-guard.spec.ts",
        "src/modules/automation/__tests__/workflow-engine-build-context-tenant-guard.spec.ts",
        "src/modules/automation/__tests__/workflow-engine-build-context-tenant-guard.static-guard.spec.ts",
        "src/modules/automation/__tests__/workflow-engine-legal-time-cutover.spec.ts",
        "src/modules/automation/__tests__/workflow-engine-remaining-tenant-boundaries.spec.ts",
        "src/modules/automation/__tests__/workflow-engine-remaining-tenant-boundaries.static-guard.spec.ts",
        "src/modules/case-balance/__tests__/case-balance-tenant-isolation.spec.ts",
        "src/modules/client-notification/__tests__/client-notification-template-tenant-scope.spec.ts",
        "src/modules/debtor/__tests__/debtor-finalization-cutover.spec.ts",
        "src/modules/debtor/debtor-identity-format.spec.ts",
        "src/modules/debtor/ihbarname-summary.tenant-boundary.spec.ts",
        "src/modules/debtor/quick-note-passive-writer.spec.ts",
        "src/modules/debtor/third-party-passive-writer.spec.ts",
        "src/modules/document/__tests__/document-fail-closed-tenant.spec.ts",
        "src/modules/error-log/__tests__/all-exceptions.filter.spec.ts",
        "src/modules/error-log/__tests__/error-dedupe-key.spec.ts",
        "src/modules/error-log/__tests__/error-fingerprint.spec.ts",
        "src/modules/error-log/__tests__/error-flood-guard.spec.ts",
        "src/modules/error-log/__tests__/error-log-retention.config.spec.ts",
        "src/modules/error-log/__tests__/error-log-retention.service.spec.ts",
        "src/modules/error-log/__tests__/error-log-tenant-scope.service.spec.ts",
        "src/modules/error-log/__tests__/error-log.controller.spec.ts",
        "src/modules/error-log/__tests__/error-log.dedupe.service.spec.ts",
        "src/modules/error-log/__tests__/error-log.sanitize.spec.ts",
        "src/modules/error-log/__tests__/error-reporter.spec.ts",
        "src/modules/error-log/__tests__/resolve-error-log.dto.spec.ts",
        "src/modules/error-log/__tests__/server-log.builder.spec.ts",
        "src/modules/esign/__tests__/esign-h2a-containment.spec.ts",
        "src/modules/esign/__tests__/esign-tenant-write-population.spec.ts",
        "src/modules/interest-engine/__tests__/golden-fixture-matrix.spec.ts",
        "src/modules/interest-engine/__tests__/scenario-diagnostic.static.spec.ts",
        "src/modules/interest-engine/__tests__/scenario-evidence.spec.ts",
        "src/modules/interest-engine/__tests__/scenario-materializer.static.spec.ts",
        "src/modules/interest-engine/calc-prep/__tests__/payment-mapper.spec.ts",
        "src/modules/interest-engine/orchestration/__tests__/case-balance.service.spec.ts",
        "src/modules/legal-deadline/__tests__/legal-deadline.service.spec.ts",
        "src/modules/legal-deadline/__tests__/legal-period-calculation.service.spec.ts",
        "src/modules/legal-deadline/__tests__/legal-period-rule-matrix.spec.ts",
        "src/modules/legal-deadline/__tests__/legal-service-date-rule-core.spec.ts",
        "src/modules/legal-deadline/__tests__/proceeding-classification.service.spec.ts",
        "src/modules/legal-deadline/__tests__/proceeding-classification.static-guard.spec.ts",
        "src/modules/legal-deadline/__tests__/service-occurrence-deadline-calculation.service.spec.ts",
        "src/modules/legal-time-shadow/__tests__/legal-time-shadow.app-module-registration.spec.ts",
        "src/modules/legal-time-shadow/__tests__/legal-time-shadow.controller.spec.ts",
        "src/modules/legal-time-shadow/__tests__/legal-time-shadow.service.spec.ts",
        "src/modules/notification/notification.service.tenant-boundary.spec.ts",
        "src/modules/pdf/__tests__/pdf-takip-talebi-authz.spec.ts",
        "src/modules/policy-engine/gate-checker/__tests__/uyap-temporary-outage.spec.ts",
        "src/modules/reporting-line/__tests__/reporting-line.service.spec.ts",
        "src/modules/risk/risk.service.tenant-boundary.spec.ts",
        "src/modules/summary-engine/__tests__/allocate-payment-ledger-in-tx.spec.ts",
        "src/modules/summary-engine/__tests__/allocation-authority.static-guard.spec.ts",
        "src/modules/summary-engine/__tests__/allocation-drift-baseline.spec.ts",
        "src/modules/template-engine/__tests__/template-artifact-tenant-scope.spec.ts",
        "src/modules/validation-gate/__tests__/validation-gate-authz-tenant.spec.ts",
        "src/scripts/__tests__/enforcement-action-backfill-classifier.spec.ts",
        "src/scripts/__tests__/enforcement-action-backfill-profiler.report-hardening.spec.ts",
        "src/scripts/__tests__/enforcement-action-backfill-profiler.static-purity.spec.ts"
      ],
      "cwd": "project/apps/api",
      "timeoutMs": 1800000
    },
    {
      "argv": [
        "pnpm",
        "exec",
        "node",
        "-e",
        "const fs=require('fs');const s=fs.readFileSync('src/modules/reporting-line/__tests__/reporting-line.service.spec.ts','utf8').replace(/\\s+/g,'');for(const m of ['listActive','listEligible']){if(s.indexOf(m+'(')<0){console.error(m+' not referenced in spec');process.exit(1);}}"
      ],
      "cwd": "project/apps/api",
      "timeoutMs": 60000
    }
  ],
  "predecessorTaskIds": [],
  "baseDriftPolicy": "STRICT_PINNED_BASE",
  "successorDisposition": "OWNER_AUTHORIZATION_REQUIRED",
  "baseSha": "6ec070d41b83bb89860f8401965250717f563672",
  "declaredIntentSha256": "f261c215698eba9fe110f2ccd12c0edba4753eb4bd91876705d99b7a689e52d1",
  "boundaryPolicySha256": "f906133efb25f7476bf883d9a9b60cc1faa712199ab1e5e4e647f771fac63d8f",
  "requiredTestsSha256": "0b6493fedea46b6c942343f92b594dd85ca6e015e49e5ff8dae83b223e87f01f"
}
